{
  "header": {
    "object_id": "META-MOD-EVENT-EXAMPLE-0001",
    "object_type": "MetaModerationEvent",
    "object_version": "0.1",
    "created_at": "2026-05-05T00:10:00Z",
    "created_by_contributor_id": "CONTRIB-REVIEW-BRIDGE",
    "created_by_role": "reviewer",
    "status": "proposed",
    "policy_tags": ["public_commons"]
  },
  "event_id": "META-MOD-EVENT-EXAMPLE-0001",
  "review_layer": "M2",
  "reviewer_ref": {
    "actor_id": "CONTRIB-AUDITOR-0001",
    "actor_type": "human_user",
    "power_grant_ref": "POWER-GRANT-AUDITOR-0001"
  },
  "target_moderation_event_ref": "MOD-EVENT-EXAMPLE-0001",
  "bridge_refs": {
    "learning_loop_record_ref": "LearningLoopRecord://example/0001",
    "learning_action_explanation_ref": "LearningActionExplanation://example/0001",
    "learning_search_record_ref": "LearningSearchRecord://example/0001",
    "learning_memory_record_ref": "LearningMemoryRecord://example/0001",
    "oracle_evaluation_ref": "OracleOfDelphi://evaluation/example-0001",
    "moirai_changeset_ref": "MoiraiLedger://changeset/example-0001",
    "policy_parameter_snapshot_ref": "policy/parameters/policy-parameter-sheet.v1.json",
    "runtime_membrane_decision_ref": "MembraneDecision://example/0001"
  },
  "fairness_judgment": "fair",
  "calibration_impact": {
    "judge_delta": 0.1,
    "conduct_delta": 0.0,
    "moderator_calibration_ref": "ModeratorCalibration://example/0001"
  },
  "basis_refs": {
    "constitutional_floor_ref": "ConstitutionalFloorPack://alexandrian/floor/v0.1",
    "evidence_refs": ["AegisVault://evidence/example-0001"],
    "sample_policy_ref": "SlashTopicPack://alexandrian/reasoning/metamod-sampling"
  },
  "rationale_text": "M1 queue action was scoped, temporary, evidence-referenced, and tied to a bridge publication surface rather than viewpoint disagreement.",
  "status": "active",
  "escalation_recommended": false,
  "created_at": "2026-05-05T00:10:00Z"
}
